{
  "schema_version": "1.0.0",
  "project_id": "",
  "video_id": "",
  "active_take_id": "",
  "source_sha256": "",
  "transcript_sha256": "",
  "cut_plan_path": null,
  "cut_plan_sha256": "",
  "locks": {
    "content": false,
    "dialogue_cadence": false,
    "montage": false,
    "visuals": false,
    "audio": false,
    "final": false
  },
  "qa_status": "not_run",
  "editorial_status": "pending",
  "user_approval_status": "not_reviewed",
  "reuse_status": "not_evaluated",
  "performance_status": "no_data",
  "last_review_id": null,
  "last_render_manifest": null,
  "updated_at": ""
}
